{
  "schema_version": 1,
  "commit": "0000000000000000000000000000000000000000",
  "lockfile_sha256": "0000000000000000000000000000000000000000000000000000000000000000",
  "tools": {
    "cargo": "1.93.0",
    "cargo-dist": "0.32.0",
    "cargo-deny": "0.20.2"
  },
  "targets": [
    "aarch64-apple-darwin",
    "x86_64-unknown-linux-gnu"
  ],
  "browsers": {},
  "artifacts": [],
  "commands": ["python3 scripts/dashboard_evidence.py check"],
  "measurements": {},
  "results": [
    { "gate": "evidence-foundation", "status": "not_run", "evidence": "Replace with retained CI artifact URI." }
  ],
  "responsible_maintainer": "unassigned",
  "approval": { "approved": false, "approved_by": null }
}
